{
  "$schema": "https://json-schema.org/draft/2020-12/schema",
  "$id": "https://chalcolith.github.io/enochian/schemas/experiment-1.json",
  "title": "Enochian experiment protocol",
  "description": "Version 1 contract for exploratory and confirmatory comparative experiments.",
  "type": "object",
  "additionalProperties": false,
  "required": [
    "schema_version",
    "experiment_id",
    "phase",
    "frozen",
    "corpus_split",
    "transcription",
    "mapping",
    "tokenization",
    "feature_set",
    "dtw",
    "length_filters",
    "lexicon_filters",
    "randomization",
    "planned_contrasts",
    "statistics",
    "outputs"
  ],
  "properties": {
    "$schema": { "type": "string", "format": "uri-reference" },
    "schema_version": { "type": "string", "pattern": "^1\\.[0-9]+\\.[0-9]+$" },
    "experiment_id": { "$ref": "#/$defs/id" },
    "phase": { "enum": ["exploratory", "confirmatory"] },
    "frozen": { "type": "boolean" },
    "corpus_split": {
      "type": "object",
      "additionalProperties": false,
      "required": [
        "selection_basis",
        "selection_uses_comparative_scores",
        "evaluation_partition",
        "holdout_partition"
      ],
      "properties": {
        "selection_basis": { "enum": ["predeclared_loci", "metadata_only_randomization"] },
        "selection_uses_comparative_scores": { "const": false },
        "evaluation_partition": { "$ref": "#/$defs/partition" },
        "holdout_partition": { "$ref": "#/$defs/partition" }
      }
    },
    "transcription": { "$ref": "#/$defs/versioned_component" },
    "mapping": { "$ref": "#/$defs/versioned_component" },
    "tokenization": {
      "type": "object",
      "additionalProperties": false,
      "required": ["method", "version", "unicode_normalization", "uncertain_tokens"],
      "properties": {
        "method": { "type": "string", "minLength": 1 },
        "version": { "type": "string", "minLength": 1 },
        "unicode_normalization": { "const": "NFC" },
        "uncertain_tokens": { "enum": ["exclude", "include_as_marked"] }
      }
    },
    "feature_set": { "$ref": "#/$defs/versioned_component" },
    "dtw": {
      "type": "object",
      "additionalProperties": false,
      "required": ["distance_metric", "normalization", "window", "mapping_selection"],
      "properties": {
        "distance_metric": { "enum": ["euclidean"] },
        "normalization": { "enum": ["path_length", "none"] },
        "window": { "type": ["integer", "null"], "minimum": 0 },
        "mapping_selection": { "enum": ["predeclared_single", "predeclared_sensitivity_set"] }
      }
    },
    "length_filters": {
      "type": "object",
      "additionalProperties": false,
      "required": ["minimum_phonemes", "maximum_phonemes"],
      "properties": {
        "minimum_phonemes": { "type": "integer", "minimum": 1 },
        "maximum_phonemes": { "type": "integer", "minimum": 1 }
      }
    },
    "lexicon_filters": {
      "type": "object",
      "additionalProperties": false,
      "required": [
        "entry_kinds",
        "parts_of_speech",
        "duplicate_forms",
        "proper_names",
        "abbreviations",
        "inflected_forms"
      ],
      "properties": {
        "entry_kinds": {
          "type": "array",
          "minItems": 1,
          "uniqueItems": true,
          "items": { "$ref": "#/$defs/entry_kind" }
        },
        "parts_of_speech": {
          "type": "array",
          "uniqueItems": true,
          "items": { "type": "string", "minLength": 1 }
        },
        "duplicate_forms": { "enum": ["deduplicate_within_source", "deduplicate_globally", "retain"] },
        "proper_names": { "enum": ["exclude", "include"] },
        "abbreviations": { "enum": ["exclude", "include"] },
        "inflected_forms": { "enum": ["exclude", "include"] }
      }
    },
    "randomization": {
      "type": "object",
      "additionalProperties": false,
      "required": ["seeds", "sample_count", "permutation_count"],
      "properties": {
        "seeds": {
          "type": "object",
          "additionalProperties": false,
          "required": ["sampling", "null_generation", "permutation"],
          "properties": {
            "sampling": { "type": "integer", "minimum": 0 },
            "null_generation": { "type": "integer", "minimum": 0 },
            "permutation": { "type": "integer", "minimum": 0 }
          }
        },
        "sample_count": { "type": "integer", "minimum": 1 },
        "permutation_count": { "type": "integer", "minimum": 1 }
      }
    },
    "planned_contrasts": {
      "type": "array",
      "minItems": 1,
      "items": {
        "type": "object",
        "additionalProperties": false,
        "required": ["id", "primary", "target_groups", "control_groups", "expected_direction"],
        "properties": {
          "id": { "$ref": "#/$defs/id" },
          "primary": { "type": "boolean" },
          "target_groups": { "$ref": "#/$defs/nonempty_string_array" },
          "control_groups": { "$ref": "#/$defs/nonempty_string_array" },
          "expected_direction": { "enum": ["lower", "higher", "two_sided"] }
        }
      },
      "contains": {
        "type": "object",
        "properties": { "primary": { "const": true } },
        "required": ["primary"]
      },
      "minContains": 1,
      "maxContains": 1
    },
    "statistics": {
      "type": "object",
      "additionalProperties": false,
      "required": ["primary_statistic", "correction_method", "alpha", "confidence_level"],
      "properties": {
        "primary_statistic": { "enum": ["mean_normalized_dtw_difference"] },
        "correction_method": { "enum": ["holm"] },
        "alpha": { "type": "number", "exclusiveMinimum": 0, "exclusiveMaximum": 1 },
        "confidence_level": { "type": "number", "exclusiveMinimum": 0, "exclusiveMaximum": 1 }
      }
    },
    "outputs": {
      "type": "object",
      "additionalProperties": false,
      "required": ["root_directory", "scores", "quality_report", "metadata"],
      "properties": {
        "root_directory": { "$ref": "#/$defs/path" },
        "scores": { "$ref": "#/$defs/path" },
        "quality_report": { "$ref": "#/$defs/path" },
        "metadata": { "$ref": "#/$defs/path" }
      }
    }
  },
  "allOf": [
    {
      "if": { "properties": { "phase": { "const": "confirmatory" } }, "required": ["phase"] },
      "then": { "properties": { "frozen": { "const": true } } }
    }
  ],
  "$defs": {
    "id": { "type": "string", "pattern": "^[a-z0-9][a-z0-9._-]*$" },
    "path": { "type": "string", "minLength": 1, "pattern": "^(?![A-Za-z]:|/|\\\\)" },
    "partition": {
      "type": "object",
      "additionalProperties": false,
      "required": ["id", "loci"],
      "properties": {
        "id": { "$ref": "#/$defs/id" },
        "loci": {
          "type": "array",
          "minItems": 1,
          "uniqueItems": true,
          "items": { "type": "string", "pattern": "^[A-Za-z0-9][A-Za-z0-9._:-]*$" }
        }
      }
    },
    "versioned_component": {
      "type": "object",
      "additionalProperties": false,
      "required": ["id", "version"],
      "properties": {
        "id": { "$ref": "#/$defs/id" },
        "version": { "type": "string", "minLength": 1 }
      }
    },
    "entry_kind": { "enum": ["lemma", "inflected", "proper-name", "abbreviation"] },
    "nonempty_string_array": {
      "type": "array",
      "minItems": 1,
      "uniqueItems": true,
      "items": { "type": "string", "minLength": 1 }
    }
  }
}
